{
  "fixture_id": "tarx.partner-sandbox.acme-systems.v1",
  "sample_only": true,
  "classification": "synthetic_demo_data_no_customer_data_no_secrets",
  "organization": {
    "id": "org_acme_systems_demo",
    "name": "Acme Systems",
    "industry": "Enterprise engineering software",
    "environment": "partner_sandbox"
  },
  "users": [
    {
      "id": "user_maya_chen",
      "name": "Maya Chen",
      "role": "Engineering Director",
      "email": "maya.chen@example.invalid",
      "sample_only": true
    },
    {
      "id": "user_eli_roberts",
      "name": "Eli Roberts",
      "role": "Staff Platform Engineer",
      "email": "eli.roberts@example.invalid",
      "sample_only": true
    },
    {
      "id": "user_nora_patwere",
      "name": "Nora Patwere",
      "role": "Security Reviewer",
      "email": "nora.patwere@example.invalid",
      "sample_only": true
    }
  ],
  "spaces": [
    {
      "id": "space_platform_engineering",
      "name": "Platform Engineering",
      "description": "Synthetic team Space for service reliability, build tooling, and developer workflow evidence.",
      "category": "Engineering",
      "labels": ["platform", "developer-experience", "sample"],
      "summary": "Track platform work, context docs, Code Worker run records, and first blockers for a fake enterprise engineering team.",
      "context_doc": {
        "id": "space_context:space_platform_engineering",
        "name": "platform-engineering-context.md",
        "mime": "text/markdown",
        "source": "context_doc",
        "content": "# Platform Engineering Context\n\nSample-only context for Acme Systems. Current focus: reduce CI queue time, document service ownership, and preserve evidence for workflow reviews.\n\nNo real customer data, credentials, private repositories, or production endpoints are included."
      },
      "space_wiki": {
        "id": "wiki_platform_engineering",
        "generated_from": ["space_context:space_platform_engineering", "run_cw_platform_ci_review"],
        "status": "sample_generated",
        "sections": [
          {
            "title": "Purpose",
            "body": "Keep platform reliability work, developer tooling notes, and evidence-backed run records together."
          },
          {
            "title": "Current Work",
            "body": "Review a synthetic CI queue bottleneck and produce a read-only recommendation packet."
          },
          {
            "title": "First Blocker",
            "body": "Execution is blocked because no sandbox write approval has been granted."
          }
        ]
      },
      "blockers": [
        {
          "id": "blocker_platform_write_approval",
          "severity": "medium",
          "summary": "Sandbox account is read-only; Code Worker cannot apply patches or run production CI.",
          "first_blocker": true,
          "status": "blocked"
        }
      ],
      "qa": [
        {
          "id": "qa_platform_schema",
          "name": "Sample run object conforms to documented fields",
          "status": "passed",
          "evidence_id": "ev_platform_schema_pass"
        }
      ]
    },
    {
      "id": "space_ai_coding_budget_review",
      "name": "AI Coding Budget Review",
      "description": "Synthetic Space for reviewing AI coding spend, route choices, and approval gates.",
      "category": "Finance",
      "labels": ["budget", "coding", "sample"],
      "summary": "Compare local Computer route, MCP tool use, and hosted-capacity approval states using sample evidence.",
      "context_doc": {
        "id": "space_context:space_ai_coding_budget_review",
        "name": "ai-coding-budget-review-context.md",
        "mime": "text/markdown",
        "source": "context_doc",
        "content": "# AI Coding Budget Review Context\n\nSample-only context for reviewing simulated AI coding usage. The review separates local work from hosted capacity and marks hosted execution as approval-required."
      },
      "space_wiki": {
        "id": "wiki_ai_coding_budget_review",
        "generated_from": ["space_context:space_ai_coding_budget_review", "run_cw_budget_packet"],
        "status": "sample_generated",
        "sections": [
          {
            "title": "Purpose",
            "body": "Help reviewers understand what ran locally, what would require hosted approval, and where evidence is missing."
          },
          {
            "title": "Budget Boundary",
            "body": "Hosted capacity is not enabled by default in this sandbox fixture."
          }
        ]
      },
      "blockers": [
        {
          "id": "blocker_budget_usage_source",
          "severity": "low",
          "summary": "Usage totals are synthetic and cannot be used for billing decisions.",
          "first_blocker": true,
          "status": "blocked"
        }
      ],
      "qa": [
        {
          "id": "qa_budget_no_billing_claim",
          "name": "Fixture does not claim billing-grade usage proof",
          "status": "passed",
          "evidence_id": "ev_budget_no_billing_claim"
        }
      ]
    },
    {
      "id": "space_security_review",
      "name": "Security Review",
      "description": "Synthetic Space for reviewing secret boundaries, evidence, and unavailable production states.",
      "category": "Security",
      "labels": ["security", "evidence", "sample"],
      "summary": "Demonstrate evidence-backed security review without exposing private data or secrets.",
      "context_doc": {
        "id": "space_context:space_security_review",
        "name": "security-review-context.md",
        "mime": "text/markdown",
        "source": "context_doc",
        "content": "# Security Review Context\n\nSample-only context. Secrets, private files, raw telemetry, and production customer data are intentionally absent. Vault references are metadata-only."
      },
      "space_wiki": {
        "id": "wiki_security_review",
        "generated_from": ["space_context:space_security_review", "ev_security_secret_boundary"],
        "status": "sample_generated",
        "sections": [
          {
            "title": "Security Boundary",
            "body": "Ordinary memory must not store credentials. Secret-like material routes Vault-first."
          },
          {
            "title": "Unavailable States",
            "body": "No production Palantir systems, customer files, or external secrets are connected in this sandbox."
          }
        ]
      },
      "blockers": [
        {
          "id": "blocker_security_no_external_approval",
          "severity": "high",
          "summary": "External system calls are unavailable without explicit credentials and approval.",
          "first_blocker": true,
          "status": "blocked"
        }
      ],
      "qa": [
        {
          "id": "qa_security_no_secret_patterns",
          "name": "Sample data contains no real secrets",
          "status": "passed",
          "evidence_id": "ev_security_secret_boundary"
        }
      ]
    }
  ],
  "runs": [
    {
      "id": "run_cw_platform_ci_review",
      "space_id": "space_platform_engineering",
      "owner": "Codex",
      "current_task": "Analyze synthetic CI queue evidence and prepare a read-only task packet.",
      "status": "blocked_first_blocker",
      "runtime_or_model": "Computer / sample Code Worker record",
      "handoff_target": "Engineering reviewer",
      "evidence_ids": ["ev_platform_schema_pass", "ev_platform_first_blocker"],
      "recent_history": [
        "Loaded sample Platform Engineering Space context.",
        "Prepared synthetic CI queue findings.",
        "Stopped before patch or CI execution because sandbox write approval is missing."
      ],
      "sample_only": true
    },
    {
      "id": "run_cw_budget_packet",
      "space_id": "space_ai_coding_budget_review",
      "owner": "TARX",
      "current_task": "Summarize synthetic AI coding route choices and budget approval states.",
      "status": "review_ready_sample",
      "runtime_or_model": "Computer / sample evidence review",
      "handoff_target": "Finance reviewer",
      "evidence_ids": ["ev_budget_no_billing_claim"],
      "recent_history": [
        "Grouped sample usage by route.",
        "Marked hosted-capacity totals as non-billing-grade.",
        "Prepared read-only budget review packet."
      ],
      "sample_only": true
    },
    {
      "id": "run_cw_security_boundary_review",
      "space_id": "space_security_review",
      "owner": "MCP",
      "current_task": "Inspect sample security boundary and unavailable external states.",
      "status": "blocked_external_approval_required",
      "runtime_or_model": "MCP / public-safe sample context",
      "handoff_target": "Security reviewer",
      "evidence_ids": ["ev_security_secret_boundary", "ev_security_external_blocked"],
      "recent_history": [
        "Confirmed fixture uses example.invalid addresses and no credential material.",
        "Confirmed public remote MCP does not expose local private files.",
        "Blocked external integration call because no approved credentials were provided."
      ],
      "sample_only": true
    }
  ],
  "activity": [
    {
      "id": "act_platform_context_loaded",
      "type": "context.loaded",
      "message": "Loaded sample Platform Engineering context document.",
      "source": "TARX",
      "status": "captured",
      "space": "space_platform_engineering",
      "ts": 1788192000000,
      "meta": {
        "context_doc_id": "space_context:space_platform_engineering",
        "sample_only": true
      }
    },
    {
      "id": "act_platform_run_blocked",
      "type": "run.blocked",
      "message": "Code Worker sample run stopped at first blocker: sandbox write approval missing.",
      "source": "Codex",
      "status": "blocked",
      "space": "space_platform_engineering",
      "ts": 1788192300000,
      "meta": {
        "run_id": "run_cw_platform_ci_review",